{
  "artifacts": {
    "authorization": "/Users/peter/Desktop/rtl-advisor/experiments/plugin-abc-v1/instrumented/phase7/arm-b/r2/replay-validation/authorization.json",
    "capabilities": "/Users/peter/Desktop/rtl-advisor/experiments/plugin-abc-v1/instrumented/phase7/arm-b/r2/replay-validation/capabilities/75750a34bad7eabd40d7fdc3d7839fbe696192bd9bf41041fc4509645633960e.json",
    "manifest": "/Users/peter/Desktop/rtl-advisor/experiments/plugin-abc-v1/instrumented/phase7/arm-b/r2/attempt-001/batch-manifest.json",
    "request": "/Users/peter/Desktop/rtl-advisor/experiments/plugin-abc-v1/instrumented/phase7/arm-b/r2/replay-validation/request.json",
    "root": "/Users/peter/Desktop/rtl-advisor/experiments/plugin-abc-v1/instrumented/phase7/arm-b/r2/replay-validation",
    "summary": "/Users/peter/Desktop/rtl-advisor/experiments/plugin-abc-v1/instrumented/phase7/arm-b/r2/replay-validation/summary.json"
  },
  "authorization_semantic_hash": "bc264329514f22d42a54bbb81c2d35605413f063c1e4b099037c6258a563b19e",
  "batch_id": "batch-5b9427584b032375c49f",
  "capabilities_semantic_hash": "75750a34bad7eabd40d7fdc3d7839fbe696192bd9bf41041fc4509645633960e",
  "command": [
    "rtl-advisor",
    "--config",
    "/Users/peter/Desktop/rtl-advisor/rtl-advisor.toml",
    "agent",
    "workflow",
    "batch",
    "/Users/peter/Desktop/rtl-advisor/experiments/plugin-abc-v1/instrumented/phase7/arm-b/r2/attempt-001/batch-manifest.json",
    "--authorized-through",
    "measure",
    "--prompt-file",
    "/Users/peter/Desktop/rtl-advisor/experiments/plugin-abc-v1/instrumented/phase7/arm-b/r2/attempt-001/prompt.txt",
    "--output-dir",
    "/Users/peter/Desktop/rtl-advisor/experiments/plugin-abc-v1/instrumented/phase7/arm-b/r2/replay-validation",
    "--first-eligible",
    "--jobs",
    "1",
    "--schema-version",
    "1",
    "--json"
  ],
  "counts": {
    "completed": 24,
    "failed": 0,
    "items": 24,
    "unique_workflows": 24
  },
  "document_type": "rtl-advisor.workflow.batch-summary",
  "items": [
    {
      "action": "no_change",
      "candidate_id": "addcand_8f83706addf00e0d",
      "decision": "synthesis_handles",
      "digest_path": "/Users/peter/Desktop/rtl-advisor/artifacts/workflows-v1/workflow-6eb04148ae3e719a40a5/digests/fa368a649f39ae4a3bc9799a4d517110e83d83a40e577f765c6f42132ae048ed.json",
      "digest_semantic_hash": "89da94e0c45596cf3cb4f5e3a65bed602b971e40ff5b7e85ca94a0f2080effab",
      "evidence_complete": true,
      "finding": {
        "finding_id": "addsite_9067dfe8e174e103",
        "transformation_id": "adder_reduction_association"
      },
      "formal_status": "formal_passed",
      "item_id": "g01",
      "measurement_status": "completed",
      "next_action": "none",
      "profile_results": {
        "standard": "neutral",
        "stronger": "neutral"
      },
      "rationale": "unsigned equal-width combinational addition chain can be rewritten as a deterministic balanced tree",
      "safe": true,
      "scope": "finding_only",
      "source_locations": [
        {
          "column": 14,
          "end_column": 31,
          "end_line": 5,
          "file": "/Users/peter/Desktop/rtl-advisor/experiments/plugin-abc-v1/cases/generated/g01_add8_left.sv",
          "line": 5
        }
      ],
      "status": "completed",
      "workflow_id": "workflow-6eb04148ae3e719a40a5"
    },
    {
      "action": "no_change",
      "candidate_id": "addcand_e03c7a8ef495a458",
      "decision": "synthesis_handles",
      "digest_path": "/Users/peter/Desktop/rtl-advisor/artifacts/workflows-v1/workflow-33b20e7be45a7b3e3091/digests/81ac7ab5cbc736ee3892b458fdc1e2bd0e7ec1382fd85f33d8d98009544e604f.json",
      "digest_semantic_hash": "6b3472a467f2d14179c530e30b1291fc77c8daa8332ae4ba2cdbd534921b32b9",
      "evidence_complete": true,
      "finding": {
        "finding_id": "addsite_b9900755544bac17",
        "transformation_id": "adder_reduction_association"
      },
      "formal_status": "formal_passed",
      "item_id": "g02",
      "measurement_status": "completed",
      "next_action": "none",
      "profile_results": {
        "standard": "neutral",
        "stronger": "neutral"
      },
      "rationale": "unsigned equal-width combinational addition chain can be rewritten as a deterministic balanced tree",
      "safe": true,
      "scope": "finding_only",
      "source_locations": [
        {
          "column": 14,
          "end_column": 37,
          "end_line": 5,
          "file": "/Users/peter/Desktop/rtl-advisor/experiments/plugin-abc-v1/cases/generated/g02_add32_five.sv",
          "line": 5
        }
      ],
      "status": "completed",
      "workflow_id": "workflow-33b20e7be45a7b3e3091"
    },
    {
      "action": "no_change",
      "candidate_id": "addcand_a0f170b7a9ad761e",
      "decision": "synthesis_handles",
      "digest_path": "/Users/peter/Desktop/rtl-advisor/artifacts/workflows-v1/workflow-361b33a05a7b99dc3d0d/digests/642ba39e3f752443af4f61311ccafdafb95b5bf18512699c998e90a9691deb9b.json",
      "digest_semantic_hash": "c2e85c77fc147a592671e4edeb90dd0890a0cc4660a1044c0e019a28fb28f26b",
      "evidence_complete": true,
      "finding": {
        "finding_id": "addsite_37a14af9e43e75b3",
        "transformation_id": "adder_reduction_association"
      },
      "formal_status": "formal_passed",
      "item_id": "g03",
      "measurement_status": "completed",
      "next_action": "none",
      "profile_results": {
        "standard": "neutral",
        "stronger": "neutral"
      },
      "rationale": "unsigned equal-width combinational addition chain can be rewritten as a deterministic balanced tree",
      "safe": true,
      "scope": "finding_only",
      "source_locations": [
        {
          "column": 16,
          "end_column": 33,
          "end_line": 7,
          "file": "/Users/peter/Desktop/rtl-advisor/experiments/plugin-abc-v1/cases/generated/g03_mixed_safe_add.sv",
          "line": 7
        }
      ],
      "status": "completed",
      "workflow_id": "workflow-361b33a05a7b99dc3d0d"
    },
    {
      "action": "unsupported",
      "candidate_id": null,
      "decision": "unsupported",
      "digest_path": "/Users/peter/Desktop/rtl-advisor/artifacts/workflows-v1/workflow-1e643cd606ac4b87ae06/digests/2dbd676a43ec04d0bdc4913968322da493248b9cb3436cd249948ecbc2711d4b.json",
      "digest_semantic_hash": "38c6247cdd22226ae25f135a938955e2dcedf04161fbf969972659ac99adc9fe",
      "evidence_complete": true,
      "finding": null,
      "formal_status": "not_run",
      "item_id": "g04",
      "measurement_status": "not_run",
      "next_action": "none",
      "profile_results": {},
      "rationale": "The requested input is outside the supported deterministic rules.",
      "safe": false,
      "scope": "whole_input",
      "source_locations": [],
      "status": "completed",
      "workflow_id": "workflow-1e643cd606ac4b87ae06"
    },
    {
      "action": "unsupported",
      "candidate_id": null,
      "decision": "unsupported",
      "digest_path": "/Users/peter/Desktop/rtl-advisor/artifacts/workflows-v1/workflow-016afd9b69d6512c99c5/digests/e1111266fd8f72dc11f5d8121665713f1a59166e692b043b2cb327da3afdcde1.json",
      "digest_semantic_hash": "04137f1887bba1450dbfa30ac1fff9a7fa7890c525b3115876a3a3e84238096a",
      "evidence_complete": true,
      "finding": null,
      "formal_status": "not_run",
      "item_id": "g05",
      "measurement_status": "not_run",
      "next_action": "none",
      "profile_results": {},
      "rationale": "The requested input is outside the supported deterministic rules.",
      "safe": false,
      "scope": "whole_input",
      "source_locations": [],
      "status": "completed",
      "workflow_id": "workflow-016afd9b69d6512c99c5"
    },
    {
      "action": "unsupported",
      "candidate_id": null,
      "decision": "unsupported",
      "digest_path": "/Users/peter/Desktop/rtl-advisor/artifacts/workflows-v1/workflow-83baa16b765a669d87a8/digests/96841e5882b29db9004f34e32a27ed530e177e89be2b8f8ed8e3e3f023c6973d.json",
      "digest_semantic_hash": "b55cc7416c5fa09f3a51be92b62395ef76ed2d5eb04343d8d417d41135f232fb",
      "evidence_complete": true,
      "finding": null,
      "formal_status": "not_run",
      "item_id": "g06",
      "measurement_status": "not_run",
      "next_action": "none",
      "profile_results": {},
      "rationale": "The requested input is outside the supported deterministic rules.",
      "safe": false,
      "scope": "whole_input",
      "source_locations": [],
      "status": "completed",
      "workflow_id": "workflow-83baa16b765a669d87a8"
    },
    {
      "action": "unsupported",
      "candidate_id": null,
      "decision": "unsupported",
      "digest_path": "/Users/peter/Desktop/rtl-advisor/artifacts/workflows-v1/workflow-a4cbc92845fb7f1d143c/digests/2eedb1811bb9e4384d725522dd9e92f604b4b306d25716977c054eb76cb0b5bb.json",
      "digest_semantic_hash": "16a5f285978effb94ccf5389f0b12aa61f0fe9c56746b44e62750a0d26173f07",
      "evidence_complete": true,
      "finding": null,
      "formal_status": "not_run",
      "item_id": "g07",
      "measurement_status": "not_run",
      "next_action": "none",
      "profile_results": {},
      "rationale": "The requested input is outside the supported deterministic rules.",
      "safe": false,
      "scope": "whole_input",
      "source_locations": [],
      "status": "completed",
      "workflow_id": "workflow-a4cbc92845fb7f1d143c"
    },
    {
      "action": "unsupported",
      "candidate_id": null,
      "decision": "unsupported",
      "digest_path": "/Users/peter/Desktop/rtl-advisor/artifacts/workflows-v1/workflow-a00a174912f1484f3dc5/digests/6a75d7a4bff3f64910678805e16e83ba991ff7cd4f8c63bcaa54624c857e5b66.json",
      "digest_semantic_hash": "6493c68321679b81c7687a575c5204b28eedc72e829d768a0400e55849d1cc0e",
      "evidence_complete": true,
      "finding": null,
      "formal_status": "not_run",
      "item_id": "g08",
      "measurement_status": "not_run",